{
  "$schema": "https://json-schema.org/draft/2020-12/schema",
  "title": "Peptide",
  "type": "object",
  "additionalProperties": false,
  "required": ["id","name","aliases","regulatory_status","category","used_for","dosing","administration_guidance","side_effects","internet_claims","research","how_to_take","what_it_does","side_effect_groups","last_reviewed"],
  "properties": {
    "id": {"type":"string","pattern":"^[a-z0-9-]+$"},
    "name": {"type":"string","minLength":1},
    "aliases": {"type":"array","items":{"type":"string"}},
    "regulatory_status": {"enum":["approved","investigational","unapproved"]},
    "category": {"enum":["weight_metabolic","growth_hormone","sexual_reproductive","tissue_repair","skin_pigmentation","immune_inflammation","cognitive_mood","longevity_mitochondrial","other_medical"]},
    "compound_type": {"enum":["peptide","protein","small_molecule","coenzyme","hormone","mixture"]},
    "used_for": {"type":"string","minLength":1},
    "dosing": {
      "type":"object","additionalProperties":false,
      "required":["basis","entries"],
      "properties":{
        "basis":{"enum":["labeled","studied"]},
        "entries":{"type":"array","items":{
          "type":"object","additionalProperties":false,
          "required":["text","population","citation_id"],
          "properties":{"text":{"type":"string"},"population":{"type":"string"},"citation_id":{"type":"string"}}}},
        "internet_entries":{"type":"array","items":{
          "type":"object","additionalProperties":false,
          "required":["text","population","source_type","url","retrieved"],
          "properties":{
            "text":{"type":"string","minLength":1},
            "population":{"type":"string"},
            "source_type":{"enum":["reddit","youtube","podcast","forum","influencer","website","vendor"]},
            "url":{"type":["string","null"]},
            "retrieved":{"type":"string","pattern":"^\\d{4}-\\d{2}-\\d{2}$"}}}}}
    },
    "administration_guidance": {"type":"array","items":{"oneOf":[
      {"type":"object","additionalProperties":false,"required":["text","label","citation_id"],
       "properties":{"text":{"type":"string","minLength":1},"label":{"const":"research"},"citation_id":{"type":"string"}}},
      {"type":"object","additionalProperties":false,"required":["text","label","source_type","url","retrieved"],
       "properties":{"text":{"type":"string","minLength":1},"label":{"const":"internet"},
        "source_type":{"enum":["reddit","youtube","podcast","forum","influencer","website","vendor"]},
        "url":{"type":["string","null"]},
        "retrieved":{"type":"string","pattern":"^\\d{4}-\\d{2}-\\d{2}$"}}}]}},
    "side_effects": {"type":"array","items":{"oneOf":[
      {"type":"object","additionalProperties":false,"required":["text","label","citation_id"],
       "properties":{"text":{"type":"string","minLength":1},"label":{"const":"research"},"citation_id":{"type":"string"}}},
      {"type":"object","additionalProperties":false,"required":["text","label","source_type","url","retrieved"],
       "properties":{"text":{"type":"string","minLength":1},"label":{"const":"internet"},
        "source_type":{"enum":["reddit","youtube","podcast","forum","influencer","website","vendor"]},
        "url":{"type":["string","null"]},
        "retrieved":{"type":"string","pattern":"^\\d{4}-\\d{2}-\\d{2}$"}}}]}},
    "internet_claims": {"type":"array","items":{
      "type":"object","additionalProperties":false,
      "required":["claim","source_type","url","retrieved"],
      "properties":{
        "claim":{"type":"string"},
        "source_type":{"enum":["reddit","youtube","podcast","forum","influencer","website","vendor"]},
        "url":{"type":["string","null"]},
        "retrieved":{"type":"string","pattern":"^\\d{4}-\\d{2}-\\d{2}$"}}}},
    "research": {"type":"array","items":{
      "type":"object","additionalProperties":false,
      "required":["id","evidence_type","source_kind","identifier","year","summary","finding"],
      "properties":{
        "id":{"type":"string"},
        "evidence_type":{"enum":["human_trial","animal_study","in_vitro","fda_label","regulatory_document","case_report","systematic_review","review","regulator_notice"]},
        "source_kind":{"enum":["pubmed","clinicaltrials","fda","regulator"]},
        "identifier":{"type":"string"},
        "year":{"type":"integer"},
        "summary":{"type":"string"},
        "finding":{"type":"string"}}}},
    "pharmacokinetics": {
      "type":"object","additionalProperties":false,"required":["half_life","t_max"],
      "properties":{"half_life":{"$ref":"#/$defs/pk_value"},"t_max":{"$ref":"#/$defs/pk_value"}}},
    "how_to_take": {
      "type":"object","additionalProperties":false,
      "required":["dose","timing","fasting","frequency","cycle_length","storage_and_handling"],
      "properties":{"dose":{"$ref":"#/$defs/summary_line"},"timing":{"$ref":"#/$defs/summary_line"},"fasting":{"$ref":"#/$defs/summary_line"},"frequency":{"$ref":"#/$defs/summary_line"},"cycle_length":{"$ref":"#/$defs/summary_line"},"storage_and_handling":{"$ref":"#/$defs/summary_line"}}},
    "what_it_does": {
      "type":"object","additionalProperties":false,
      "required":["mechanism","best_documented_effect"],
      "properties":{"mechanism":{"$ref":"#/$defs/summary_line"},"best_documented_effect":{"$ref":"#/$defs/summary_line"}}},
    "side_effect_groups": {"type":"array","items":{
      "type":"object","additionalProperties":false,"required":["title","summary","items"],
      "properties":{"title":{"type":"string","minLength":1},"summary":{"type":"string","minLength":1},
        "items":{"type":"array","minItems":1,"items":{"$ref":"#/$defs/sourced_item"}}}}},
    "last_reviewed": {"type":"string","pattern":"^\\d{4}-\\d{2}-\\d{2}$"}
  },
  "$defs": {
    "pk_value": {
      "type":"object","additionalProperties":false,
      "required":["value","unit","statistic","population","route","citation_id"],
      "properties":{
        "value":{"type":"number","exclusiveMinimum":0},
        "unit":{"enum":["minutes","hours","days"]},
        "range_low":{"type":"number","exclusiveMinimum":0},
        "range_high":{"type":"number","exclusiveMinimum":0},
        "statistic":{"enum":["mean","median","approximate","range_midpoint","effective"]},
        "population":{"enum":["human","animal"]},
        "species":{"type":["string","null"]},
        "route":{"enum":["subcutaneous","intravenous","intramuscular","oral","other"]},
        "note":{"type":"string"},
        "citation_id":{"type":"string"}}},
    "summary_line": {"type":"object","additionalProperties":false,"required":["summary","items"],
      "properties":{"summary":{"type":"string"},"items":{"type":"array","items":{"$ref":"#/$defs/sourced_item"}}}},
    "sourced_item": {"oneOf":[
      {"type":"object","additionalProperties":false,"required":["text","label","validity","citation_id"],
       "properties":{"text":{"type":"string","minLength":1},"label":{"const":"research"},
        "validity":{"enum":["strong","moderate","low","very_low"]},
        "conflicts_with_label":{"type":"boolean"},
        "citation_id":{"type":"string"}}},
      {"type":"object","additionalProperties":false,"required":["text","label","validity","source_type","url","retrieved"],
       "properties":{"text":{"type":"string","minLength":1},"label":{"const":"internet"},
        "validity":{"enum":["strong","moderate","low","very_low"]},
        "conflicts_with_label":{"type":"boolean"},
        "source_type":{"enum":["reddit","youtube","podcast","forum","influencer","website","vendor"]},
        "url":{"type":["string","null"]},
        "retrieved":{"type":"string","pattern":"^\\d{4}-\\d{2}-\\d{2}$"}}}]}
  }
}
